Title,Creators,Genre,Rating,Likes,Subscribers,Views,Synopsis
Flagbearer,Cyartlee,action,9.10,113915.0,64438.0,1316649.0,"To hold a flag, to be a Flagbearer, means being known as the strongest, to live an absolute existence and be an absolute symbol. These are the values Sey remembers when he falls onto a new world. Not knowing anything except that a mysterious crystal-encased flag waits for him, the flag his father once held, he takes hold of it and ventures forth with a fated friend not knowing that the world will soon change as his tattered flag resurfaces onto a new era."
Flawed Almighty,"Carnby Kim, RH Song",supernatural,9.60,2246307.0,247438.0,15759959.0,"Do good or go to hell. The conditions of his new curse seem simple enough for once-hopeful hoodlum Jeonji Kim. Or so it seems when his perky guardian angel shows up on his doorstep one day and heals his limp. But will simply going through the motions of helping people be enough to appease a petty god with a grudge?
"
Flawless,Shinshinhye,romance,9.45,2515281.0,404344.0,25260975.0,"Sarah is a tough girl who prides herself for being independent. One day, after fending off several boys harassing her in the street, she meets Elios, a young blind man her age. She is immediately charmed by him, though he maintains an air of mystery. Has Sarah met her first love? Is everything what it seems?"
Floating in My Mind,hcy,supernatural,9.18,517895.0,161848.0,3750671.0,"One summer day, Sandeul returns to Garam’s small high school. Garam doesn’t really remember him, although they used to be friends when they were little. Sandeul is outgoing, handsome, and popular whereas Garam is a shy social outcast, ignored by all her classmates. However, that mundane summer changes when Garam finds out about Sandeul’s secret. And Garam will not be able to forget it, because Sandeul will keep floating in her mind...
"
Flow,Honey B,fantasy,9.75,3031831.0,726761.0,66329085.0,A fantasy comic about a boy's destiny that starts to change as he receives a gift from his guardian god.
Flower Pot Crew,Cute Prawn Studios,drama,8.29,61878.0,22325.0,516283.0,"Casper's father was a father only in name -- the man never showed him love, and his mother had mysteriously disappeared. Knowing how to care was never a priority, so being part of a gang was perfect for Casper... until they decided to sabotage him. With no money, friends, or family, a cheery Ben suddenly shows up in his life. As their story begins in sunny Singapore, will the cold-hearted Casper escape his tortured past... and finally learn how to love?"
Fluffy Boyfriend,Mihi,supernatural,9.11,5012968.0,1400000.0,95409064.0,"A cursed girl's life changes forever when her cat, who lived with her quietly for a long time, shows her his real human form. Fluffy Boyfriend is a love story in a world of half-animal humans secretly living in plain sight."
Fluidum,"GirlsOnFilm, ValeriaM",drama,9.02,1764115.0,201181.0,12108177.0,"Jesse was born like every citizen in the Fluidum universe, spending their first 20 years shifting seamlessly between a male and female body. Now with only one year left until they must choose one body for the rest of their life, Jesse is questioning the unquestionable... why decide at all?"
Following Eunju,Cherry Lee,thriller,9.30,227434.0,72827.0,1838351.0,"""This series contains themes regarding mental health, sexual violence and child abuse that may not be suitable for all readers. Viewer discretion is advised. If you or someone you know is struggling or in crisis, please reach out for help at Crisis Text Line (http://crisistextline.org/)."" Minjun sets up a fake profile to get Eunju, his crush, to accept his follow request on social media. Now, with her daily activities and whereabouts available at his fingertips, he uses this information to move in as her next-door neighbor. But little did Minjun know, that Eunju’s life isn’t anything like what she posts online–this sends him down an unexpected path, where he learns that following Eunju turns out to have its consequences."
Fool Me Twice,JiJi,romance,9.02,287989.0,83016.0,2840161.0,"They say freshman romance can make or break college life. So it was for Min Kim, whose heart was shattered two years ago by beautiful upperclassman Bora Kwon. Min re-enters college after his military service hoping for a fresh start, but as luck would have it, his old flame has also just returned from a long leave of absence. As he struggles to bury lingering feelings and move on with his life, Min encounters Jina Bae, the firecracker-next-door who begins to find a place in his heart.

"
For My Derelict Favorite,"Kim Seonyu, Kimyong, Ryuho",romance,9.79,6611763.0,968575.0,73024323.0,"What happens after the story ends with a “happily ever after”? 
When Hestia enters her favorite novel as a side character, she happily fangirls from the sidelines. Thinking she’ll return home when the story reaches its end, Hestia finds that the only thing awaiting her is the tragic death of her favorite character.
Now miraculously restored to the day of the ending, Hestia decides that she’ll no longer spectate from the sidelines – instead, she’ll save her derelict favorite! 
"
For the Princess Who Will Disappear,"942, Rimha, seodamyeon",romance,7.97,103639.0,93617.0,1426260.0,"You’re saying that I, a barmaid who grew up on the streets, might be the princess…?!
After pawning off a necklace, Sasha finds herself embroiled in a game of politics and enters the Imperial Palace as the long-lost Princess Anastasia. The secretive romance between Sasha, a shrewd and daring back-alley-raised “princess,” and the stern Duke Lascan, fiancé to the missing princess who vows to stay by Sasha's side, unfolds!
"
For the Sake of Sita,Haga,romance,9.53,366874.0,262851.0,9411048.0,"A medical student passionately falls in love with a fallen goddess during his volunteer abroad in Nepal, and he desperately tries to fight off destiny to save his love."
For the Third Time,"Got W, NARA",romance,9.25,944676.0,335448.0,8659906.0,"Dohee is too busy girl-bossing her way up the corporate ladder to care about love. Her ability to randomly time loop makes her professionally successful but also renders all relationships meaningless. What's the point when she'll have to restart everything at some point? That all changes when Joonwon, her annoying new boss, reveals that he can time loop too. Though she cringes at the mere sight of him, he's also the only person who understands her. Will they learn how to find solace in each other, or will their professional friction mess up their one chance at love?"
Forest of Humans,Junho Hwang,thriller,9.53,385905.0,124853.0,3183246.0,A secret experiment on serial killers conducted in the woods? What could possibly go wrong? Follow one young researcher's descent into madness and self-doubt as she attempts to escape a locked facility with ten bloodthirsty murderers. Will she make it out with her humanity intact?
Forever After,"Hannah Patten, JEON Hoyun, JEON Segi, Violet Matter, WmW","comedy, fantasy",9.37,3871843.0,425034.0,25915660.0,"Robin just wants an easy life. Land a prince, live like a princess; it worked out for Cinderella. Self-respect need not apply. When her wish to live out a real-life fairytale is misinterpreted by the Fates, she finds herself in the storybook realm of Forever After, only she's not a princess at all! Cast as the Prince, Robin must fight her way through the broken stories of her youth and restore their happy endings if she ever hopes to return home. Some things in Forever After are not quite as they were written, and Robin is not the only one racing through the tales. Stuck with all the responsibility she never wanted, Robin could be the hero to save them allâ€”but not if the Wicked Witch has anything to say about it."
Forged in Flames: The Piece Maker,"Mozza, SSUNG",fantasy,9.08,61400.0,30519.0,546874.0,"It’s red, hot, and burning with flames!
Sage is a young boy from a small village who dreams of becoming a renowned Piece Maker like Edmond Dantes. But when his antics to help others with crafting skills get him in trouble with the local mercenary gang, a trio of rowdy blacksmiths who call themselves the Red Pepper Guild show up and come to his aid.
He joins the Red Pepper Guild in their quest to solve the mystery of strange dungeons and mana stones, but can he survive the battles and the blazing dishes his eccentric guild master cooks up?
"
Four Leaf,Lumaga,fantasy,9.72,2251544.0,239667.0,16059721.0,"Lupe hasn't been able to adapt very well to the new schoolâ€¦ though she hasn't really been able to adapt to anything ever. Four Leaf is a story about a bunch of dangerous magical girls, but most specially about one not-at-all-magical girl."
Fray,GO100,action,9.49,365391.0,109657.0,2921638.0,"In a world filled with demons, only knights blessed with miracles can fight against their tyranny. During a moment of desperation, Magpie was given a miracle, the one and only flame that can kill demons. But that very flame turns its owner into a demon that thirsts for ashes…
“Put in the firewood, if you don’t want to turn into a handful of ashes.”
"
Freaking Romance,Snailords,romance,9.76,21426194.0,3402727.0,290053559.0,"A sexy supernatural story about being out on your own, finding your dream apartment and discovering that your new place is haunted by a handsome spectral stranger from another dimension. Sure, HE can't see you and YOU can't touch him, but who said every relationship starts out perfectly?"
Friday: Forbidden Tales,"BAE jin soo, Bae Jin-Soo",thriller,9.18,594714.0,196710.0,14190662.0,"Every Friday, forbidden tales will be revealed."
From Morning to Night,JiEun Son,fantasy,9.32,316829.0,140856.0,2323387.0,"When the town of Night relocates all of the townspeople to build a temple for its goddess Obscurity, 12-year-old Mane and 9-year-old Nox start a new life in the neighboring town of Morning. Trouble awaits them when Nox vanishes as if by magic, and Mane turns to Morning's goddess Lumiere for help. Told that he must vanquish Obscurity to save his kidnapped sibling, Mane is given the body of a grown man and sent on a perilous journey. Will Mane be able to save his sibling in a world where nothing is as it seems?"
From Old Country Bumpkin to Master Swordsman,"Kazuki Sato, Shigeru Sagazaki, Tetsuhiro Nabeshima",graphic_novel,7.66,16137.0,36557.0,218062.0,"Middle-aged Beryl Gardenant has only ever accomplished one thing: running a humble sword-fighting dojo in the quiet countryside. But when he’s paid a visit by his former pupil, Allucia, he discovers that she has become an elite commander—and she’s hardly the only ex-student who’s a renowned warrior! Now forced by Allucia to become a special instructor to the strongest order of knights in the kingdom, can Beryl reach his full potential even though he’s an old man?"
From a Knight to a Lady,"Hyerim Sung, Ink.",fantasy,9.69,8889486.0,978368.0,88119713.0,"Estelle meets her untimely death as a valiant knight of the Kingdom of Ersha. But death is not the end for Estelle -- three years after her demise, she finds herself reincarnated in the body of Lucifela Aydin, the spoiled and cold-hearted daughter of a count in the Empire of Jansgar. To her dismay, she finds that her country fell to Jansgar years ago, and that she is now betrothed to Zedekiah Heint, the son of a duke and her adversary in her previous life. Can Estelle discover the truth behind her death while attempting to navigate her new life as Lucifela?"
Frozen Hearts,HWIYO,fantasy,9.45,260728.0,144966.0,2509794.0,"Hiding her identity as a Snow Maiden demon, Seolha has carved out a life in disguise among humans. However, her life changes forever when she catches the interest of the Northern Prince, a man known for hunting down and killing demons, and agrees to become his bride. Will these two be able to overcome their differences and live happily ever after?"
G.O.D.,blaukornbrot,drama,9.15,230096.0,115248.0,2290262.0,"In a world plagued by a mysterious infection that grants superhuman abilities while affecting the mind, a seemingly ordinary boy named Ben is drawn into the chaos. Little does he know that there is more to him than meets the eye, and his destiny is entwined with the fate of humanity."
GANDA: Night Defender,"Linka08, Nikki Dibya Wardhana",action,9.67,75337.0,46138.0,516495.0,"The cheerful but clumsy college student Rika encounters constant misfortune in her normal life. When a missing report forces her to break the school’s rule against setting foot on campus after 9 pm, things take a turn for the worse. She soon finds herself under attack by an evil spirit known as a Djinn! Fortunately, Ganda, The Night Defender, comes to her rescue. To show her gratitude, she decides to be a Night Defender’s assistant. But does she have what it takes?"
GOSU,"Giun Ryu, Mun Jeong Hoo",action,9.85,6537072.0,767479.0,96730077.0,"When his master dies, Gang Yong pledges to avenge his teacher at all costs. After training his martial arts skills in seclusion, Gang Yong sets off to hunt down the traitors and make them pay! But when he gets to town, he discovers they're... already dead? Well, what's he supposed to do now?!"
Game Master,"Akaogi seki, hibnkuma",fantasy,9.11,100514.0,77563.0,1056881.0,"""Gamemaster,"" a high school streamer, dedicated his life to beating the supposedly unbeatable game ""Hero's Destiny."" Finally succeeding after ten years, the realization that he's wasted his life is short-lived, as the game asks him to keep playing—only for him to wake up inside the game after he agrees, in the body of Callix Szcecin, the meek young son of a count. Together with Lyla, the maid and assassin hired by his stepmother who failed to kill him, Russel, the loyal knight, and Kraut, a young knight with much potential, Callix must survive the game again, in person."
Garden Club Detective Squad,"52chu, Bryan Arfiandy, Nikki Dibya Wardhana",mystery,9.74,1100321.0,207731.0,6165869.0,"Gardening and solving crime aren't what straight-A student Yeon Han thought she would be focusing on at her new school. But when she discovers a notebook that contains clues to a 15-year-old murder mystery, she and the other members of her new gardening club realize the murderer not only has access to the school -- they probably work for the school. Can the gardening club squad figure out who committed the murder even though the principal and their teachers seem desperate to cover it up?"
Garden of the Dead Flowers,"Corbenyx, Sero",thriller,9.39,313886.0,132209.0,3664607.0,"When she wakes up, Mila immediately notices that she has been inexplicably transported to the year 1940, during the time when the Dutch Colony was reigning supreme in Batavia. Confronted with this perplexing predicament, Mila is compelled to find a way to return to her own time. Yet, her efforts take an ominous turn as she stumbles upon a shocking scene—a man, her very own grandfather, committing a heinous murder in his garden, where he proceeds to bury the unfortunate victim amongst his flowers."
Gates of Hell,"Dennis Culver, Yuki Saeki",thriller,8.18,202000.0,77511.0,1749517.0,"Jennifer's life completely changed after her mother died. Her old cheer squad and ex-boyfriend made that very clear as she fell from their social ranks. It wasn't until she discovered her mother's old spellbook that Jennifer got her second chance: to find her mom's soul, and tell her ""I love you"" one last time. But when the spell opens a window to Hell; she doesn't find her mother on the other side- but instead a handsome Devil Prince who may hold the key to unlocking her new abilities..."
Gecko Chan,"Meritxell Garcia, RE ME",comedy,9.18,605128.0,88920.0,4182588.0,"Gecko Chan is a young monster with uncontrollable strength. After moving to a new city, Gecko will have to learn to fit in a city that wasn't prepared for his monstrous size."
Gepetto,Jewon Yeon,"sci-fi, sf",9.78,764321.0,172849.0,15211726.0,"A hundred years ago, the genius inventor behind androids, Professor Gepetto, left behind a mysterious inheritance. After the war between humans and androids has ravaged the planet, androids start to break down and run out of time, while humans are struggling to survive in the lifeless wasteland that is Earth. A single blue-haired android left behind in the Professor's estate may be the key to solving the crises as decades-old plans are finally set into motion."
Get Schooled,"GARAM HAN, Yongtaek Chae",drama,9.78,3100000.0,407700.0,28700000.0,"Hwajin Na's teaching techniques are pretty violent for someone who works in the Ministry of Education. That being said, when punishments don't seem to work on even the worst of school bullies, there is no better man for the job. Sometimes you can't get a good education until those bullies are taught a lesson."
Ghost Bats,"Jeong Summer, Walter Ostlie","sci-fi, sf",9.16,124433.0,58925.0,815227.0,"Ghost Bats, a semi-decent punk band, is suddenly thrust into a galactic Battle of the Bands to defeat their rivals....while conjuring giant monsters?! Can the band survive their interplanetary star trek and win the Grand Prize or will this be their final encore?"
Ghost King,"PARK JINSEOK, SON GOHOO",action,9.40,438185.0,157699.0,4785530.0,"What if the world was divided into people with martial arts powers and people without? Taeyeon Kang was one of the lucky few born with such powers. He enrolls in Murim Police University, a special school for those with powers to stand on the side of justice… but he has a secret of his own. He’s here to uncover the truth behind his father’s disappearance as well as seek protection from the Evil Murim Faction which is after his family’s secret book of martial arts techniques. At the same time, the legendary Ghost King makes his grand return, years after his mysterious disappearance. Just who is this masked anti-hero?
"
Ghost Teller,QTT,horror,9.86,5413019.0,1042578.0,55149454.0,You think your ghost stories are scary? Try listening to these stories from the ghosts themselves.
Ghost Theater,LICO,drama,9.77,2231745.0,411665.0,16527190.0,The shock of a tragic accident leaves talented actress Rahee Ku unable to make facial expressions. Her acting career seems hopeless... until she discovers the mysterious Ghost Theater.
Ghost Wife,Sejung,romance,9.73,10807074.0,1377679.0,142319479.0,"Liz is a normal teenage girl who can see monsters... that want to eat her. The only person who can save her is a demon with a creepy smile and an appetite for live cats. But first, she has to become his fiancÃ©!"
Ghost on the Roof,Klaus Scrimshaw,drama,9.54,288436.0,103006.0,2148745.0,"In modern-day Paris, 20-year old Christine Daaé is an aspiring opera singer whose dreams were shattered by a traumatic incident during an audition one year ago. She has all but given up on returning to the stage, until a mysterious voice on the roof of the Paris Opera House offers her the chance to get her life back. But in order to achieve her dreams, she'll have to ask herself if she's willing to believe in this ghost… and if she can trust him.

A modern retelling of ""The Phantom of the Opera"" by Gaston Leroux."
Ghosts Among the Wild Flowers,Ghost Wintersnow,fantasy,9.60,483205.0,122931.0,6836132.0,Â¨Ghosts among the wildflowersÂ¨ is a webcomic about a group of strangers coming together to search for a treasure they arent sure even exists.
Girlfriend Manual ,saefira (Merlin),romance,9.24,513181.0,203096.0,4508283.0,"Athena is desperate. Why is dating girls so hard? Even though she's doing everything to become the ""it"" girl- the skincare, the workouts, and even the university she goes to- nothing is working. Where is Athena's love story? Every crush ends in disaster, every date is a flop, and her confidence is running low. But then she meets Levi, the handsome yet mysterious barista. Athena can’t keep her eyes off of her! She knows she can't mess this one up and her friends have just the solution. Athena needs... the Girlfriend Manual."
Girls Have a Blog,"Sarah Bollinger, Tara Kurtzhals","slice of life, slice_of_life",9.17,734546.0,140722.0,6589158.0,"Creating comics, playing videos games, eating burgers - everything is better when it's with your best friend. Learn how to adult with Tara and Sarah every Saturday!"
Girls of the Wild's,"HUN, ZHENA",action,9.56,8011837.0,925458.0,178533779.0,"Wild's High School, an all girls educational institute specializing in MMA, has a very special freshman enrolling this year. Jaegu, who fears women from being abandoned by his mother, is about to find out what girls are really all about in this action-packed school drama."
Glacias,"Nawa, Yaruno",fantasy,9.42,96780.0,44343.0,650495.0,"Dragons don't seem scary when you've been raised by one, but how do you convince the rest of the world their fear is misplaced? Determined to create a city where humans and dragons can live together, Juka sets out with his dragon Lyth to challenge traditions and history itself. Can the everlasting hatred between two kinds be broken by a single boy and his dragon? "
Go Away Romeo,Paintword,romance,9.09,4458497.0,872658.0,46604904.0,"Rosaline believed that she and Romeo were destined to be lovers, but an unexpected tragedy comes when he dies on the same day as her cousin, Juliet. Rosaline learns she has one last memory of Romeo— a son. However, Rosaline’s loving memory of Romeo is shattered when she learns of his betrayal. With no one left to love and protect but her son, the last thing she wants is for Romeo to return to Verona and take everything she holds dear."
God Tribe,"Agu_JUNU, SEOPASS",fantasy,9.48,639398.0,210078.0,7425408.0,"Latde, a member of a near-extinct God Tribe called The Hwan Tribe, is being raised in the hands of the Carnivore Tribe on the remote Carnivore Island, far away from the mainland. The Hwan Tribe members being raised on the island are sent away to the Hwan Continent upon reaching adulthood, and Latde’s older brother Latz has already left the island to live a new life in their homeland. But as Latde nears adulthood, the secret of the island is revealed, plunging it into turmoil."
God of Bath,Ilkwon Ha,comedy,9.51,324661.0,129500.0,5777984.0,"To escape from a loan shark hunting him down, 23-year-old Heo Se runs straight into a mysterious and luxurious public bathhouse. After a strange twist of fate, he ends up working as a massage scrubber and has to fight to be the last scrubber standing. Let the battle to become the best scrubber... begin!"
God's Gambit,"2HD, Bsamong, SECAN STUDIO",action,9.25,252609.0,86612.0,2750198.0,"Do gods play dice with the fate of entire cities?
Yul Choi’s city is suddenly transported to become a piece in a board game of the gods. Just when Yul thinks he can work together with people to overcome the monsters and challenges, he realizes he must become the city’s greatest villain to save the city. Can Yul rise to the demanding task of becoming the greatest and most villainous hero his city has ever seen?
"
"God, Please Make Me a Demon!","Bulsa, Yomgary",comedy,9.38,1100000.0,318400.0,8000000.0,"At a glance, high-schooler Moran Baek appears to be a beautiful girl who's perfect in every wayâ€¦ or so it would seem. In reality, she is an exiled demon who has been trapped in a human body for over 5,000 years. When she learns that she is still unable to use her demonic powers despite finishing her exile, Moran despairs and struggles to find a way to become a demon again. One day, she accidentally discovers that doing a good deed restores her powers, and sets out to find a way to keep doing good deeds so she can return to her devilish ways."
"God, Please Make Me a Demon! ","Bulsa, Yomgary",comedy,9.45,1860013.0,420697.0,14530897.0,"At a glance, high-schooler Moran Baek appears to be a beautiful girl who’s perfect in every way… or so it would seem. In reality, she is an exiled demon who has been trapped in a human body for over 5,000 years. When she learns that she is still unable to use her demonic powers despite finishing her exile, Moran despairs and struggles to find a way to become a demon again. One day, she accidentally discovers that doing a good deed restores her powers, and sets out to find a way to keep doing good deeds so she can return to her devilish ways."
Godzilla: Unnatural Disasters,IDW Publishing,graphic_novel,9.50,3234.0,16320.0,36726.0,"The King of the Monsters is back in this compendium collecting three series: Legends, In Hell, and Rage Across Time! In a world where monsters roam freely, some stories have been lost to time... until NOW! In Legends, the kaiju of Godzilla's fearsome rogues gallery get the spotlight. Featuring Anguirus, Rodan, Titanosaurus, Hedorah, and Kumonga! Then, meet Godzilla's greatest adversary of all time‚ the impossible tortures of Hell! It's a monster battle that takes you through the depths of the underworld. Move over dinosaurs... monsters used to rule the planet! In Rage Across Time, travel to different time periods to examine the origin of myths that fueled nightmares: Feudal Japan, ancient Greece, medieval England, and classic Rome!"
Going Up,Melissaboo,romance,9.28,642222.0,119093.0,3904612.0,"She might only walk dogs now, but Cece dreams of joining the world of high fashion with her unique and stunning designs. But with barely any money for materials, let alone for rent; she'll need a miracle in the form of a lost dog to give her the opportunity of a lifetime. Will she finally reach her goal, or will a new passion spark new dreams?"
