Title,Creators,Genre,Rating,Likes,Subscribers,Views,Synopsis
The Apothecary Prince,"BK_Moon, Dadang, kangho HA",fantasy,9.21,1101112.0,322898.0,9671127.0,"In a twist of fate, the life of a doctor of Korean medicine flips upside down in a single night. 
Doctor Han Lee is reborn as Lachiel, the sickly Crown Prince of the Empire of Magentano. 
Han is now armed with medical knowledge and skills found nowhere else in this new world -- but can he heal an empire and mend his own body at the same time? 
Witness his journey of self-exploration and resilience as he maps destiny's meridian, in pursuit of the acupoint that can reverse his fate."
The Archmage’s Restaurant,"Bad boys, INUS, Mr.Cha",fantasy,9.34,97725.0,109898.0,963437.0,"A young aspiring chef suddenly finds himself in a world of war, dragons, and magic. These two worlds couldn’t be further apart... or could they? 
Who says you can’t open a restaurant in a fantasy realm? I mean, what could possibly go wrong?
A perfect series for fantasy, magic, and food lovers.
"
The Artist Salieri,Baekwondal,drama,9.41,66738.0,20900.0,522742.0,"Life is so unpredictable. Myeong-hwa had everything: the pretty face, the artistic talent, and even a wonderful boyfriend, while Sun-hee had nothing. Ten years later, the roles have reversed and Myeong-hwa is still a poor and unknown artist while Sun-hee is a major figure in the art world. What Myeong-hwa doesn’t know is that Sun-hee has secretly been pulling strings to make sure she fails…"
The Bad Son,Jeong Chan,action,9.55,99015.0,73549.0,1352461.0,"Blood ties bind, but vengeance severs, and in the heart of a heartless man, a fire ignites.
Pildu Kang, a prosecutor born into a legacy of corruption, uncovers his family's harrowing involvement in his mother’s murder. Now, a chilling vendetta awakens the monster within, drawing out the primordial urge he has long sought to contain.
Will he rely on the law to be his ally on this treacherous path, or will he become the judge, jury, and executioner?"
The Badguys,"Luke Lancaster, Orlando Caicedo","super_hero, superhero",9.42,361163.0,110818.0,6090782.0,"THE BADGUYS is a superhero comedy heist comic with a cast of characters supremely out of their depth. Dealing with daddy issues, bad breakups, decades-old grudges and profound professional inadequacies, the whole endeavour is pretty much a foregone conclusion. Badguys never win: There are rules, after all."
The Barbarian of Seoul Station,"Jin Seol woo, LICO",action,8.74,147415.0,74985.0,1580381.0,"Cheoldu, a barbarian raised on Earth, lives a mundane life with his best friend Jintae. But when he sees an alien creature from his planet on the news, everything changes. Thrown into an apocalyptic challenge, Cheoldu and Jintae must adjust their lives in Nova, a savage world filled with goblins and ogres. Will the two conquer Nova’s perils and uncover the secrets that could change Earth’s fate? An epic tale of friendship, survival, and untamed adventure awaits."
The Beloved Incompetent Stepmom,"KII AOFUJI, Tsuruko Maruko, irukura",romance,9.47,281701.0,304924.0,3650834.0,"Dismissed as incompetent and neglected by her family, the Duke’s daughter, Elsha, is suddenly ordered to marry the infamous Archduke Iceberg—a war hero feared for his ruthless reputation. Rather than despair, she seizes this chance for a fresh start. But upon arriving at his manor, she finds the Archduke missing and is instead met by his wary adopted sons, Wilbert and Hugh—who had no idea their father was remarrying. With an absent husband, distrustful stepchildren, and a manor full of secrets, can Elsha carve out a place for herself and find happiness at last?"
The Black Serpent,angyungal,action,9.90,55292.0,34930.0,399889.0,"“I shall destroy the factions of justice and avenge the deaths of my comrades!” Jeonghwa, the captain of the Black Serpent Squad, loses everyone she grew up with when the lawful factions betray them after the battle against the chaotic factions. On the verge of death herself, she must now claw her way up to deliver true justice to the so-called justice factions.
"
The Blind Prince,cozycroww,romance,9.75,2986119.0,482080.0,23051879.0,"Elaine desperately tries to hide the unearthly feathers that riddle her skin, all for the sake of love. But her curse leaves her rejected and trapped behind a wall deep within the forbidden forest. With no way home, her only option is to rely on a Prince determined to reclaim his throne, and his missing eyes."
The Blood of the Butterfly,"Remin, SAM",fantasy,9.73,8300000.0,494303.0,18823464.0,"When a swarm of giant bugs threatens to wipe out humanity, the world's only defense is a group of humans with special abilities called Butterflies. For Maehwa Baek, Butterflies are just heroic people he sees on TV until a tragic event brings him to the scientists that created them. Soon, Maehwa must confront questions about himself that he has long avoided: why does he lose control at the sight of his own blood? And what happened during the 13 years of his life that he can't remember?"
The Boxer,JH,sports,9.86,11727225.0,1654966.0,176045629.0,You've got the raw talent. Or you're the underdog. But do you have the heart? Do you have what it takes? Let's see what you're made of. The real fight starts now!
The Breaker: Eternal Force,"GEUKJIN JEON, JINHWAN PARK",action,9.47,1168000.0,405183.0,17824809.0,"Haje Kang can’t take it anymore. Pushed to the breaking point by relentless bullying, Haje stands at the edge of the school roof, ready to end it all. But just as he’s about to jump, he’s given a push -- literally -- by a mysterious upperclassman named Si-un Lee, only to wake up the next day, unscathed. Little does Haje know that Si-un happens to be one of the most powerful martial artists in the Murim, the hidden world of martial arts. Haje begs Si-un to train him, but he never could have imagined just how tumultuous things could get in the martial arts underworld…
"
The Brooklynite,"Seth Kushner, Shamus Beyale","super_hero, superhero",8.98,35028.0,21596.0,679327.0,"Brooklyn cartoonist, Jake Jeffries gets caught in the fallout of two super-humans battling and is accidentally irradiated with superpowers. Fraught with ""Superman powers and Spider-Man problems,"" Jake learns to fight crime in his secret identity as The Brooklynite, and chronicles his adventures in a comic book series while struggling to lead a dual existence."
The Build Up,911,sports,9.77,2103941.0,265054.0,23488200.0,"Maru Kang was just an ordinary kid with ordinary interests, until one day his father forces him to watch a soccer game on TV, sparking an obsession with the sport. Filled with determination, he sets a new goal for himself -- to become an amazing soccer player! The only problem is, he has already been proclaimed the ""King of the Losers"" at his high school. Can Maru overcome the obstacles in his path and transform into a talented and successful soccer player?"
The Child of a Star,Sunny,fantasy,5.90,72419.0,62921.0,677346.0,"Born under the Star of Darkness, Princess Baekseon always knew she was fated for something big, but it’s only after she disguises herself as a boy and leaves the safety of the palace that she begins to see just how big. Malicious old hags, cheerful goblins, lovesick witches, and the promise of a mysterious soulmate with red and blue eyes are just the beginning: ultimately, what hangs in the balance is the fate of the world itself."
The Cliff,Sungdae Oh,thriller,9.32,123434.0,86122.0,2344928.0,"Tensions rise as two men wait for someone to save their lives after falling and getting stranded on the cliffside of a dangerous hiking trail. When days pass with no indication of help, the cliff becomes a stage for confrontation, violence, and madness."
The Constellations Are My Disciples,"Cha jiwoon, INUS, Indoor Kim",fantasy,9.05,1822353.0,406522.0,27729763.0,"300 years ago, the invincible warrior Hyeon-oh Kim brought down the Tower of the End, preventing the world’s demise. Though he should have died the moment the Tower of the End collapsed, Hyeon-oh  is reborn 300 years later in the body of a 17-year-old boy named Juhyeok Kim. Meanwhile, he discovers the existence of the Constellations, who were once his disciples 300 years ago but were born during the time when he did not exist in this world. Will he be able to find them again and train them?"
The Count's Secret Maid,"Baekjua, MIDNIGHT STUDIO, TON",drama,9.63,419287.0,194663.0,3685034.0,"For Paula, not a single day passed by without a reminder of her ugliness. But it was her hideous face that spared her from being sold to a brothel or dying tragically like her sisters. So when Paula's father sells her off to work at an esteemed nobleman's mansion, she realizes that peasant girls are a disposable resource. However, she finds the young Count Belunita tucked away in an annex, shamefully hidden from the curious eyes of the public. And as Paula struggles to appeal to her tyrannical master's whims, she must also embrace her role as his secret maid."
The Croaking,echorise,fantasy,9.78,8711470.0,690181.0,71698850.0,"The Roost - the world's most prestigious military academy - has never accepted a Crow into its ranks. Until now. However, the conditions surrounding Scra's acceptance are shrouded in conspiracy, and his new roommate Ky won't rest until he finds out just where he goes every night. Between flight tests, classes, and Murders, Scra, Ky and Ree must band together to uncover the truth about their utopia and the whispers of a superweapon - ""The Croaking"" - that are seeping from the cracks."
The Crown Princess Scandal,"Jeonghyeon, KITROW",fantasy,9.85,2153984.0,281560.0,17690118.0,"Victimized by her little sister's trick, Hwa-yeong heads to the imperial palace to participate in the crown princess selection process. Now she'll have to put up with… six months of palace stay?! No way! As a last resort, Hwa-yeong tries to do everything wrong to get disqualified and sent home early but instead finds herself in the royals' favor. What's worse, coincidence keeps bringing Shin-yeong, the Crown Prince, in her way, and now things are becoming more intense and personal for both of them. ""You wish to get kicked out now? I'll do everything in my power to see the opposite happen!"" Will Hwa-yeong see her way through these obstacles and return home before six months?"
The Cup of Vengeance Is in Your Hands,"JIBSA, SCAMPER, tado",fantasy,9.26,946408.0,319651.0,10056407.0,"Princess Eudith’s story begins when her cruel brother, the king, sells her off to the neighboring kingdom to marry the queen’s powerless stepson, Prince Franz. Eudith becomes a pawn in the queen’s plot to discredit Franz and place her biological son, Krald, on the throne.

Desperate, Eudith attempts to end her misery but wakes up on the day of her fateful journey. Armed with knowledge and experience from her past life, Eudith seizes the chance for revenge by helping Prince Franz take his rightful place on the throne. Will Eudith succeed in her revenge and find happiness?"
The D!ckheads,GummyBunni,romance,9.15,1910981.0,438049.0,22209924.0,"After being bullied at her old school, Eliana decides to move to the small town of Oaksdale to start fresh. There she befriends Football Captain and most popular boy at school, Levi, as well as lone-wolf and outcast, Marco. She's finally got the friends she always wanted, but what will she do when she finds out they hate each other?"
The DaneMen,David Danemen,comedy,9.07,485413.0,41747.0,8791883.0,"""Show, don't tell. That's what they told me.
  
 ""The DaneMen"" is a silent comic strip. People all look the same.
  
 There are three main flavors: absurd, truthy and grim.
  
 Hitchcock said ""Drama is life with all the dull bits cut out.""
  
 Too bad. Life is 99% dull bits. Seems like a waste of bits to me.
  
 Chaplin said ""Life is a tragedy when seen in close-up, but a comedy in long-shot.""
  
 Well...""The DaneMen"" has close-ups, long-shots, AND mediums-shots!
  
 Take that, Chaplin!"""
The Dang Clan’s Swordmaster Heir Just Wants a Normal Life,"Hwagye, PSG, SUPJA",action,8.89,219142.0,79069.0,2624214.0,"The Dang clan of Sacheon, once renowned for its poison and hidden weapons, is now on the path to its demise.
That is, until Yeonmyeung Dang, an outcast boy of the clan, awakens by recollecting the memories of his past life
as the 'god of swords' who devoted his life to mastering the sword.

Will the boy be able to protect his family and fulfill his dream of living a normal life?"
The Dark Lord's Confession,Topseoung,fantasy,9.74,3069765.0,558678.0,27834567.0,"What happens if you end up summoning the Dark Lord, the whole continent’s greatest enemy? Due to a battle that took place over a thousand years ago, cursed people become demon-like magicians, and those who are blessed become holy knights who protect the kingdom. Lapis, who hides her identity of being a magician and aspires to be a holy knight, accidentally ends up summoning the Dark Lord. Along with the Dark Lord’s puzzling confession, Lapis’ journey of becoming a holy knight begins! "
The Death of Kindness,Skeleton_House,action,9.21,61375.0,45878.0,541616.0,"After the mysterious murder of his parents, Yoichi Sakagami struggled to live a normal life taking care of his young siblings. The only way he survived was by exploiting a mysterious ability he had to regenerate his organs. But when shadowy forces come after him, he'll find that there's more to his ability than he thought. Will he be able to control it to get his revenge and protect those he cares about? Or will the power he has control him instead?"
The Demon Faction’s Return,"Han Yurim, MISANG, Team the J",fantasy,9.16,109802.0,71134.0,1308103.0,"In an effort to escape the power struggle within the Heavenly Demon Sect, the protagonist Myeong-un retreats to a life of seclusion. However, simply avoiding ambition for the throne is not enough to avert tragedy. 

Myeong-un flees from the sect leader Myeong-gak, who seeks fratricide, before meeting his demise. At the moment of his death, as his consciousness fades, he hears a voice. 

""Do you regret it? Do you wish to fight again?""""

To his surprise, Myeong-un, believed to be dead, opens his eyes once more....
			"
The Demon King's Warrior Daughter,"Geobong Choi, Jumeok, Ppangbaksa",fantasy,9.36,288476.0,138946.0,2983393.0,"Nobody said being a parent was easy. It’s especially hard for Belphegor Verscios, the adoptive father of an exceptionally gifted human girl who insists on becoming a warrior someday and defeating the Demon King - who, unbeknownst to her, happens to be him. But when you’re a doting father like Belphegor, what else can you do but try to support her dreams while simultaneously making sure she never reaches her goal? It’s a fine line to walk, but he must succeed at any cost, or suffer the worst fate he could ever imagine… disappointing his daughter.
"
The Devil is a Handsome Man,Hellothisisangle,drama,9.55,2470677.0,814791.0,32862014.0,Xolia makes the deal with the devil in order to obtain her desires. But she soon finds that this deal is shrouded in more mystery than she could have imagined.
The Devil’s Kiss,"Kwak Dabin, Park Nahyeon, sparrowqueen",romance,8.55,205860.0,110697.0,2820687.0,"On the brink of death, Eunji is approached by a handsome devil named Joshua, who promises her a second shot at life with a kiss to seal the deal. When Eunji wakes up to her “second” life, nothing seems different until Dojin, the human manifestation of Joshua, shows up at her school and starts following her everywhere she goes, turning heads and causing drama. Their honeymoon period is cut short when yet another devil, Sora, comes to ruin their fun. Can Joshua save his first love from the forces of Earth and hell?"
The Distance Between Us,YUJU,romance,6.75,441782.0,209124.0,5113295.0,"Haemi is an ordinary high school art teacher. Sure, she gets scolded by the principal a lot, but her personality makes it impossible for anyone to hate her. While Haemi has her eyes set on one of her fellow teachers, things start to get a little more complicated when her old childhood friend steps into the picture. Between the confusion and the drama, the three of them keep crossing paths in unexpected ways.
"
The Doctors are Out,Blau,romance,9.58,7582389.0,642231.0,58002376.0,"The beloved Dr. Matias Guevara tends to his patients in his little neighborhood health clinic, unaware that Dr. Fernando Guevera opened his new veterinary clinic right next door! With their patients confused and their tolerance running thin, the two grown men constantly bicker and compete! Will their similar names and professions cause their rivalry to go untreated, or will they heal each others broken hearts?!"
The Dog Diaries,yee seon,"slice of life, slice_of_life",9.68,1045377.0,91925.0,5780940.0,"Dana is a freelance illustrator who feels lonely and stressed out from working all day and doing little else. But this all changes when she is joined by a new four-legged friend: a small Pomeranian puppy called Myeongdong. This cute little pup shows her what unconditional love looks like, and Dana does her best to look after her new pal, too."
The Double Agent,"Charles, Hayeon, Piececake",historical,8.82,1234395.0,335771.0,13125562.0,"As a child, Sasha Laurent lost her parents overnight when the Dochen Republic invaded and burned her hometown, Neroi. Fleeing across the border, she lived off the streets until rescued by General Gerard of the Allied Forces. A decade later, when he asks her to infiltrate Dochen as a secret agent, she has no choice but to comply, but soon finds herself a prisoner at the mercy of Major General Johann von Willendorf. Sasha's unhealthy obsession with Johann veers dangerously close to love, but will her feelings change when he makes her a double agent?"
The Dragon King’s Bride,"Kanghee Jamae, SOY MEDIA",romance,8.86,5005354.0,1674295.0,106270726.0,"Ten years ago, a young girl saved the life of a dragon. Little did they know that they would be brought together again by the vicissitudes of fate, when Lucina’s family estate is invaded by the fearsome Tayar nation led by King Hakan. After Lucina’s selfish stepmother offers her up as a bride to Hakan in exchange for their lives, Lucina realizes that she is now fated to journey to the arid kingdom of Tayar and marry its seemingly brutish king. Will fate lead the unlikely pair to ruin or romance? 

"
The Druid of Seoul Station,"Jin Seol woo, Mun sung ho, liveBear",action,9.44,5136919.0,700932.0,65320939.0,"What started out as an ordinary day turned upside down when an unknown catastrophe struck Earth, transporting Suho Park to a different planet. He eventually learns how to adapt and fight for his survival in this foreign world, but one day, just as suddenly as he was sucked into this new planet, Suho is pulled back to Earth. He quickly learns that return to life as he remembers it is no longer possible, as Earth is in constant battle with monsters who’ve managed to infiltrate the planet. How will Suho fight against the monsters attacking Earth, and will he be able to survive this time with his current skills?"
The Duke's Cursed Charm,"Goyogom, Lemon Frog, Sohwagi",romance,9.25,2306030.0,611489.0,27616968.0,"Duke Carhel Luave is known as the devilish duke due to his uncontrollable magical ability to charm every single person who lays their eyes on him. But this is more of a curse than a blessing with several noble houses plotting to drive him out of power. Having no one he can genuinely like or trust, Carhel wonders if he will ever be able to feel the warmth of another human being. One day, after raiding the estate of one of his enemies, Carhel mistakenly has Lena, the house’s maid, captured in the aftermath. But when he tries to use his charming powers to give her a painless death, something unexpected happens. For some reason, Carhel’s powers have no effect on Lena!"
The Duke's Teddy Bear,"Choi Sungha, GOMDOL",romance,8.77,1767161.0,364878.0,16176719.0,"What if your soul could leave your body and possess people -- or even animals?
Thanks to an incident in the past, that’s what happens to Marshall Lidiance every time she passes out or falls asleep. No one knows her little secret, but things become problematic for Marshall when she gets absorbed into a teddy bear owned by the icy-cold Duke Ludvillian! Will Marshall be able to figure out what caused the soul absorption while still keeping it a secret from everyone?"
The Dummy's Dummy,Mochamura,horror,9.80,1681295.0,232469.0,11803512.0,"The story of a psychic girl named Yumi, an eerie living puppet named Paris, and the strange and often deadly monsters they face off against. Ghosts, ghouls, and... possessed teddy bears? Oh, my!"
The Dungeon Cleaning Life of a Once Genius Hunter,"Dalbeat, GoilGoil",action,9.47,2855158.0,554404.0,30779390.0,"World’s first SSS-ranked genius hunter, Junu Kim. He regresses ten years into the past after being ambushed by unknowns one day. With all his hunter skills now locked, he must fulfill his career as a dungeon cleaner to unlock them. But this cleaner… is extraordinary! The once renowned hunter, Junu Kim, takes over the cleaning duty with vigorous determination.
"
The Eagle and the Snake,Angel Tovar,action,9.56,576909.0,151660.0,5241803.0,"Abel's crew has pulled off daring heists around the world -- too bad he doesn't get to keep any of the money. Every dollar goes to the lords of crime who hold his brother hostage, and Abel has no choice but to fulfill their every demand. But when a dangerous woman enters his life and old debts are due, how far will he go to save the only family he has left?"
The Earth's Chosen Savior,"Ha jung soo, Shinel",action,9.09,641609.0,210607.0,6103096.0,"The Earth has a message for all of its inhabitants: the world is ending in 42 days, and monsters will bring about the apocalypse. Game studio employee Jeong-u Park is selected by the Earth as someone who can save the planet, but he must first survive in a world where people are now killing each other for power. He also must compete with other saviors to retain his planet-saving abilities. As doomsday approaches, can Jeong-u become the savior the world needs?"
The Ember Knight,"Hwandaeng, K. Oliver",fantasy,9.78,3355579.0,366829.0,35488696.0,"When Nagyunn's twin brother, Najin, is murdered before his very eyes, he vows to avenge his brother's death by assuming Najin's identity. But although the two may look alike, when it comes to fighting, Nagyunn lacks the talent and skill his brother possessed. In order to successfully execute his plot for revenge, Nagyunn resolves to train himself to become the prodigious knight-in-training his brother once was. Will Nagyunn be able to keep his identity a secret before others begin to catch on to his act?"
The Emperor's Puppy,"Lee huin, Namdogyeom, muneobal",fantasy,8.92,73297.0,73685.0,779019.0,"Many people dream of being reborn as a princess in another world. And Hari, an ordinary woman, finds herself in that exact situation… or so she thought. Instead of flowy hair and the beautiful face of a princess, she has stubby limbs and shiny black toe beans. Yup, she’s been reincarnated in a palace in another world as a dog. And a talking one, at that! Will she be able to survive as the pet of the emperor rumored to be a ruthless tyrant? Will she ever be able to turn into a human? Find out in this humorous story about a little talking puppy living in a fantasy world!"
The Empress’ Lipstick,"Coffeebean, JJG, Park-myoung woon",fantasy,8.97,1141354.0,200787.0,11433519.0,"Jae-in is a typical middle school girl obsessed with beauty and makeup and wishes to become a makeup artist. One day, she finds a mysterious lipstick by chance, which leads to the opening of a mysterious portal that warps her to a different dimension. When she wakes up the next moment, she realizes she has become a princess of a different world! Stuck in this mysterious world, will Jae-in be able to find a way out? Or better yet, will she be able to pursue her passion for beauty and live the life she could never live before?"
The Empress’s Two Wolves,"Honey Bambi, LICO",romance,8.65,782221.0,440178.0,10889229.0,"In a world where destiny is branded on their skin, Sepia, the human empress of the beastkin empire, is threatened by a new rival: Titié, a white deer, with Demios the emperor’s name emblazoned on her chest. Amidst Titié’s malicious attempts, Sepia clings to her role as empress and the Star of Ishtar, determined to fulfill her destiny as the empire’s savior. Enter Roxan, a wolf beastkin and cousin to Demois, whose allure stirs Sepia’s feelings. In a web of love, loyalty, and deception, can Sepia reclaim her power and discover the truth of her heart?"
The End is a Game to Me,"HOOPA, Woo Jin Choi",action,9.59,555461.0,156065.0,5709529.0,"Cheonsu Go is a shut-in NEET whose day-to-day is playing games and streaming to his one viewer. One day, he finds himself thrown into the midst of a survival game as a player character. The only clear condition for the game is to survive. The camera is rolling, and the 24/7 broadcast of his fight for survival begins now!"
The End of Ma'at,"NODOWDY, Yaruno",action,9.07,103175.0,52482.0,946435.0,"Despite years of endless offerings, she died all the same. What purpose then do the gods serve? Enraged by the death of his sister, Khai and his mythology-obsessed brother Rehu set out on a journey through the Duat, the treacherous realm of the Egyptian underworld, with one goal in mind: Revenge. Can a simple human like Khai truly topple the gods, or is there more at play in the land of the dead?"
