Title,Creators,Genre,Rating,Likes,Subscribers,Views,Synopsis
 This Wasn't My Plan,"BOM SOHEE, SEI KIM",romance,8.60,509745.0,126211.0,5139129.0,"In a twist of fate, Ro-a finds herself thrown back a decade in time. This isn't just a trip down memory lane. She's faced with a younger, naive Sihyeon, the future superstar who would brutally wrong her. Armed with knowledge of what's to come, Ro-a sees a golden opportunity: a chance to rewrite their history. Can she resist the allure of revenge and change Sihyeon's destiny before he becomes her nightmare?
"
#Blessed,M. Victoria Robado,drama,9.18,2055736.0,438390.0,22430919.0,"Joanna is a mid-twenties office girl who likes social media and watered down coffee. While griping about her love life, she accidentally swiped right on a whole Pantheon of Gods and Goddesses! Looking to fulfill an ancient prophecy, only one of them will be able to claim Joanna as their own... after a nice dinner, that is!"
#Killstagram,Ryoung,thriller,9.31,3816843.0,933881.0,45459497.0,"Remi Do has everything -- she's super pretty, has the best brand sponsorships on social media, and gets 10,000 likes within seconds of posting a selfie. Oh, and she also has a serial-killing stalker following her every move."
#muted,kandismon,romance,9.12,515668.0,190216.0,4736547.0,"Jasper's heart lights up when he meets Kai, a boy who doesn't speak, and life becomes a little less lonely for them both. But when old wounds threaten to reopen, their ever-growing connection is put to the test. Will the silence stand in the way of their love, or will they find a way to communicate the feelings they both have?

This series contains themes regarding mental health that may not be suitable for all readers. Viewer discretion is advised. If you or someone you know is struggling or in crisis, please reach out for help at Crisis Text Line (http://crisistextline.org/)."
'Til Debt Do Us Part,"Flowbee, janggreen",romance,9.70,2299546.0,533458.0,26536673.0,"Subin's mom routinely pays for matchmakers to set her up on dates. Subin turns them all down, one after another. One day she runs into an old friend from school, and things start to get complicated when he suddenly asks her to marry him. Is he the answer to her prayers or a devil in disguise? Will she take this chance to clear her debt?"
+99 Reinforced Wooden Stick,"HONGSIL, JIPERY",comedy,9.27,3279450.0,647063.0,46385066.0,"Welcome to “Chrono Life,” a virtual reality game where only the strongest survive.
Ji-u logs in to “Chrono Life,” only to be ignored and ridiculed by the other players for his lack of experience, crappy items, and being an overall noob.
But when he upgrades his wooden stick to the max reinforcement level of +99, Ji-u realizes he has the power to split continents and slay armies of thousands in just one swing.
“It’s time to teach the rest of you a lesson, you f*ckers.”"
1 Second,"kwang woon, sini",action,9.63,1091942.0,123223.0,7453573.0,Every second counts when you're a first responder. But what if you could see a glimpse into the future? Hosu is a firefighter with the supernatural ability to do just that. There’s just one catch. It only works when he feels extreme stress under pressure. Will knowing what will happen ahead of time help Hosu extinguish fires before they completely destroy homes and lives? And will he learn to wield his ability when he needs it most?
100,"Hyeong Eun, Yunyeol Choi",action,9.18,285891.0,129924.0,2662857.0,"Armed only with a gun and a frying pan, Hoyoung Cheon must survive Battlegrounds: a battle-royale style game with 100 participants, where there’s only one way to win: kill the 99 other players, all of them death-row convicts. Hoyoung has another objective besides survival, though -- he must find an assemblyman who was captured while investigating the game, and is now an unwilling participant. Can Hoyoung complete his mission on an island with 99 people willing to kill to survive, and emerge the last one standing?"
1000,"Chuck Brown, Sanford Greene",action,8.98,84218.0,108224.0,1515168.0,"Set in a modern world of aliens, warlocks, zombies, and ancient beasts, ""1000"" follows Dragon Son - a supreme entity who's abandoned all creation as he struggles to return to his true Dragon form by completing 1,000 acts of repentance. Son is joined by five other agents who are charged with secretly policing the world and keeping civilization from crumbling completely."
10th Dimension Boys,Cutbu,comedy,9.34,1037144.0,118607.0,31497858.0,"In another dimension, anything can happen in your daily life. Absurdly funny, the boys from the 10th dimension are up to no good again."
11 of Me,"Jaeyeong Yeong, Jiae Go",supernatural,8.81,228486.0,105711.0,1698015.0,"To Gibeom’s surprise, the mechanical calculator he bought working at a junkyard turns out to be a time machine! With the time machine, he sets out to find and bring together his past selves. Currently, all 11 versions of Gibeom are living together peacefully, but unexpected problems materialize as Gibeom(s) interacts with people outside of his circle..."
1111 Animals,1111,comedy,8.89,276446.0,51148.0,7305626.0,The secret lives of animals
1HP Club,elfboi,fantasy,9.64,7992424.0,755107.0,71083150.0,"A comic about the daily life of dungeon boys. Slaying the city, saving the dragons... or something like that."
2015: Space Series,Various Artists,"sci-fi, sf",9.26,70618.0,61784.0,1172916.0,Collective Comic Essays on the Universe and Beyond
21st Century Knights,Plastic Bottru,fantasy,9.41,1175706.0,225997.0,8210330.0,"Not all knights wield armor and swords; some are capable of summoning ethereal weapons known as ""Animas"". And if you are strong enough, you might be able to join the legendary Knight's Order. As part of the Knight's Order, your duty is to protect and serve the people. Theresa, however, has her own goals, and that is to find the white-haired knight. She'll make any sacrifice to do so. But what will she do when her pursuit for a single silver thread unravels the entire fabric that hides a sinister truth about knights and the world that they live in?"
23:4,TerraTerrific,supernatural,9.38,146968.0,90618.0,1308131.0,"As an angel of death, Eden is tasked with fetching human souls and leading them to judgement before they can transform into monstrous creatures known as Unresteds. He hopes his job will be easier when Celestino joins the crew, but the aspiring angel of music has other goals and refuses to cooperate. With the Unresteds growing stronger by the day, Celestino, Eden, and the other death angels must work together or face the same fate as their predecessors."
28th Century Superfan,Cutbu,comedy,9.54,336850.0,66901.0,2337440.0,"Join a struggling Author and her biggest Stan, who traveled back in time from the 28th century, in the duo’s wacky, bizarre, topsy-turvy, and wild roller-coaster adventure. Together, will they end up creating the best-seller novel of all time? Join their comedic journey to find out!

This series contains crude humor that might not be suitable for all audiences. Viewer discretion is advised."
3-Second Strip,"BAE jin soo, Bae Jin-Soo",comedy,8.51,905165.0,68162.0,17304351.0,Just spend three seconds of your day on this three-panel comic!
30 Minutes With You,ondo,romance,9.76,751501.0,82441.0,4747579.0,"Seongeun has always walked home alone from Galaxy Academy... that is until she met Gubong! Now, the two of them spend 30 minutes walking home together once a week. This 30-minute walk home becomes an exciting time for both of them as their friendship grows... into a budding romance?"
3X3!,MNYujacha,comedy,9.50,105883.0,48246.0,788309.0,"Ménage à trois? More like menace à trois! As a bashful, introverted BL lover, all Minji Kim ever wanted for her final year of middle school was to be left alone to draw dinosaur-themed superhero smut -- Ahem, tasteful fanfiction. So exactly how she became part of the so-called Future Vision Club with school rebel Hae-in Shin and straight-laced student Jisu Han, she’ll never quite understand. The only thing that’s clear is that the year ahead promises to be unforgettable, to say the least! So, prepare for trouble and make it… triple?

"
"66,666 Years: Advent of the Dark Mage","BAEKSSE, Dopack, Hwabong",fantasy,9.72,5288910.0,694686.0,54215159.0,"Diablo Volpir, a powerful dark mage, was defeated and sealed away in a battle against the 12 gods. He finally wakes up from his sleep 66,666 years later, however, in the body of a newborn baby, Jamie Welton! 9 years later, with a fraction of power he once held and with the loving family and peaceful environment he is now surrounded by, Jamie plans to exact revenge against the 12 gods that had sealed him away."
6th Degree,vultie!,action,9.50,312872.0,161155.0,3721730.0,"What is the price of revenge? Kris knows she’s different but lives in the dark about her power, controlled by her father’s supervision and her job as “The Cleaner,” doing the dirty work of the Hyuu Police Department. When she finally has a chance to learn more about herself, her father is murdered by a vicious crime syndicate. Eden, the chairwoman of a rival crime family, gives Kris another chance at life. With vengeance on her mind, will Kris adapt to her new life in the underworld, or will she fall deeper into the pit?"
7FATES: CHAKHO,HYBE,fantasy,9.86,2678393.0,1585911.0,34703779.0,"In the corrupt city of Sin-si, Zeha suddenly wakes up in a hospital, unable to recall anything that happened after speaking with a mysterious man one night. He soon learns that strange beings called beom are wreaking havoc on the city. As destiny brings seven boys together, will they succeed in ending this fight, once and for all? Let the hunting begin!"
A Bittersweet Life,Donggeon Lee,"slice of life, slice_of_life",9.31,483157.0,97637.0,6995101.0,"A collection of sweet stories about couples and singles, office workers and unemployed people. 
 But be warned: there's more than a touch of bitterness here."
A Budgie's Life,Muffin Girl,slice of life,9.79,7300000.0,337600.0,66800000.0,"When it comes to birds we think they are just fluttering little creatures who have no contact with humans whatsoever. But bird owners know that's not true! Like pet dogs and cats, birds have a personality of their own.."
A Chance At Last,"Dindon, Seo hye eun",romance,9.49,1512092.0,273561.0,14423445.0,"Sisters Ju-eun and Hyejin grew up in absolute poverty. After their mother’s death, Hyejin accepts the offer to join their estranged father’s wealthy family. But when Hyejin turns out dead just three years later, Ju-eun is grief-stricken. She grabs at the chance to travel back in time and take her sister’s place where she meets the kind but mysterious Iho."
A Child Who Looks Like Me,"FLADA, PATNOC",romance,9.56,920323.0,486033.0,11541676.0,"A surprise pregnancy sends Jeong-o, a college junior, into a panic. Her supportive boyfriend Jiheon plans a loving proposal, but a car accident erases his recent memories, including their romance. Seven years later, they reunite unexpectedly—but Jiheon has no recollection of Jeong-o or the fact that they share a precious daughter between them."
A Couple of Obligations,"ASONA, Eun, GULDAK, Pinku",romance,8.58,453781.0,185287.0,5411439.0,"“I will marry you, but I have no intention to share a bed with you.”
The charismatic princess of Bashar meets the sharpest sword of the empire!
The life of the two newlyweds united for alliance is a battle in itself.
The tingling thriller of a romance between two brave and beautiful individuals who have never loved unfolds!"
A Dance of Swords in the Night,"JP, MinskySong, Yu jin sung",action,9.58,914959.0,152332.0,8612819.0,"Kidnapped as a child to be trained in the art of poison, Sohan Jin returns to his hometown in search of the group of New Moon Sword Dancers who raised him. However, upon his return, Sohan discovers the sword dancers have been defeated by a nefarious sect that now rules the area, with some members having been abducted. What would have been a heartwarming reunion transforms into a quest for revenge as Sohan begins his search for the remaining sword dancers, and he’s willing to poison anyone who gets in his way."
A DeadbEAT's Meal,CHEESE,"slice of life, slice_of_life",9.20,885499.0,126640.0,6175682.0,"Now a major (K-Drama) adaptation.                                                                                                                                                                                                       
What’s better than a good meal? My name’s Jaeho and I love food. While some may call me a deadbEAT because I don’t have a job at the moment, I’m just your normal happy guy who loves eating and my girlfriend of 7 years… That is until I got a breakup text yesterday… Where did things go wrong? I keep trying to look back through the years, but I just can't figure it out..."
A Demon's Wish,"Muneki, Zigozi9",romance,9.28,812353.0,436431.0,17733377.0,"Doya Seo, a demon, is one day captivated by a mysterious dream. That same day, he happens upon Wish So, a new freshman. Curiously, each moment their paths intersect, Doya finds himself engulfed in a perplexing whirl of emotions and physical sensations that his demonic sensibilities fail to decipher. Meanwhile, Wish finds herself amidst a flurry of events after being invited to the home of famous actor Jaehyeon Woo. In a world where the supernatural coexists with humanity, and caught between the devilish charm of Doya and Jaehyun’s allure, will Wish be able to navigate her school life without trouble?
"
A Fake Affair,Akiko Higashimura,romance,9.18,232021.0,49309.0,1601628.0,"After searching and failing to find a husband for 3 years, Shoko Hama is ready to give up. Tired from work and marriage-less future prospects, she quits her job and travels on a solo trip to Korea. On the plane ride there, Shoko meets the young and attractive Jobanni Park, but accidentally tells him… she’s married? Now caught in her own web of lies, Shoko is about to have the wildest time of her life!"
A Flame Reborn,"Painkiller, Saint Nine, Yang Pyung",action,9.45,368010.0,118199.0,4539771.0,"Logan MacLine, a middle-aged knight fighting for the independence army, is intent on getting revenge against the empire which took over the kingdom and executed his brother when he ends up dying in battle. But when he wakes, he is a young man again, and has yet to be disowned for his terrible behavior. Using his experience and knowledge from his past life, Logan recruits a few talented individuals to develop new weapons, build an army, and make enough money to fund it all. But will he be able to make amends with his family and stop the empire's march?"
A Flower Blooms on the Wall,"Eunjeong, Myeonla, Park Yeong",romance,9.21,212675.0,160554.0,2723438.0,"“Of course I recognized you. You’re my first love.” Living a life of being stalked by her first love, Dam Do is visited by her brother’s friend Yun Oh. No longer the boy next door who used to follow her around like a puppy, Yun is now a man, and he acts strangely aloof around her. While Dam has found herself resenting her first love, Yun is secretly quite excited to be around his first love once again. As the two become reacquainted after their time apart, they may be in for a lesson on what love really is."
A Good Day to be a Dog,"Lee Hey, Lee Hye",romance,9.84,11227234.0,1433149.0,113873554.0,"Hana has made every effort to avoid an inevitable family curse... of turning into a dog after her first kiss. Worst of all, the only way for her to break the curse is to get a second kiss. How will that work when Hana's first kiss is with a guy who is deathly afraid of dogs?!"
A Heart for the Emperor,"6S, Studio wooridle",romance,6.99,593185.0,271073.0,8218654.0,"Our protagonist ends her day as usual, rereading her favorite novel before sleep. But, after awakening in the body of Princess Charlioni of the Kingdom of Linoa, the protagonist of that very novel, she realizes that it's only a matter of time before her kingdom is ruthlessly defeated at the hands of Casikaf, the blood-thirsty Emperor of Pretas. Fortunately, she has the upper hand of knowing that he’ll fall madly in love with her at first sight. But when the novel starts veering off track and every character isn't who they appear to be, she'll have to take matters into her own hands to get her happy ending. "
A Heartfelt Andante,Na Yoonhee,drama,9.48,260035.0,100310.0,1679961.0,"One man’s death led to another man's salvation. After years of suffering from heart disease, Da-ul receives a heart transplant from young and renowned pianist Yuwon, who has died an unfortunate death in a car crash. Da-ul’s life has been forever changed by this priceless gift, and he pledges to make every second of his life count in gratitude. But when he meets Yeonjo, the woman his donor was deeply in love with, and finds out that she has been living in despair, he begins developing ambivalent feelings towards her. Is it guilt, or could it be something else?"
A Husband I Didn’t Expect,"Damsu, Got W, The Greedy Gatsby",romance,8.08,53392.0,106155.0,977600.0,"Gyeo-ul has lucked into a marriage with a rich, handsome, and kind man. The catch? She has no idea how it happened.
After an accident wipes out the past year of her memory, Gyeo-ul finds herself living a life she doesn't recognize: Sihu Kang, her sworn enemy, is now her doting spouse, and he won't stop gushing over her.
“Wait, I have to share a bed with this guy? And kiss him, too?! Why does he keep saying he loves me?!”
Something about this marriage doesn’t add up.
"
A Killer Paradox,kkomabi,thriller,8.93,93235.0,29759.0,716690.0,"A man wakes up, tied to a crucifix. He’s a district attorney, held prisoner by a serial killer named Tang Lee. Why is he there? And who is this twitchy man staring him down?
As the story unfolds, we follow Tang Lee’s descent from average nobody to murderer. The catch? All of his victims are revealed to be criminals, rapists, and killers who had escaped justice.
Is Tang an angel of retribution? Or is it all in his mind? At every turn, a new dark corner of society’s decay comes to light in this twisted thriller.
"
A Kiss Before I Sleep,Chaeeun Lee,romance,9.29,35466.0,68213.0,504948.0,"Jiho has a superpower that causes explosions whenever she gets excited, making dating and fun nearly impossible—until she discovers that touching her new neighbor, Yechan, miraculously helps her control her ability. Determined to maintain physical contact without outright harassing him, Jiho embarks on a mission to “seduce” Yechan and become his girlfriend. Along the way, ghostly advice and a whirlwind of chaos lead her to uncover the mystery of their unique connection in this unpredictable romance."
A Knight With a Time Limit,"GEUMUIHAENG, KDRM, Yunyeol Choi",fantasy,8.85,113875.0,58311.0,1193887.0,"Leaving behind his miserable life and untimely death,
Luis Cloyde is reborn into a new world filled with fantastical beasts and adventure.
The catch? He must continue killing other living beings to extend his own life.
But given a second chance at life, Luis Cloyde is willing to do just about anything to survive.
"
A Life-Changing Turn,"Ghna, Gwang-jin, YOPY",thriller,9.32,98718.0,61094.0,1101072.0,"My name is Sua Jo, and my life couldn't get any better - my loving dad is a Mayor, my handsome boyfriend is the top dog in school, my fun-to-be-with friends love me, and my background is top-notch. My life is perfect. But wait, did I just hit someone?! No, no I didn't... No one saw me, so nothing happened. My life is still perfect, or so I thought... until ""M"" appeared claiming to be a witness. You think I'll let you ruin my perfect life?! Just wait until I find you!				"
A Man's Man,"Dogado, Ha Neulso, Lucas",drama,9.82,1364826.0,137431.0,11054652.0,"Yuhyeon becomes the youngest CEO of Hansung, a successful electronics company built on toxic work culture, but nobody he cares about is there to celebrate with him. After a night of drinking and wondering if he could change the past, he wakes up the next morning, 20 years younger at the beginning of his career. Armed with the experience and insights that made him CEO, Yuhyeon begins to revisit broken relationships and battle the enablers of Hansung's cut-throat work environment. But he does not yet know how changing the past will affect his future..."
A Mark Against Thee,gotaeho,drama,9.52,336700.0,60488.0,3277990.0,"Innocent man framed for murder and sentenced to death. Released 17 years later after his name was cleared. The times have changed. Yeop has changed. His friends and family have changed. Nothing is the same anymore. The harsh reality surrounding him turned Yeop from a grateful young man to a stoic, skeptical person. And now, he wants to exact revenge on everything that worked together to ruin his life."
A Martial Master Wakes Up as a Concubine,"LICO, koyanghee",fantasy,9.68,2257439.0,431761.0,20338595.0,"Once a notorious master of the deviant sects, Nyeonbi Cheon pays a hefty price for her romance with a man of a virtuous sect, Won Gae of the True-spirited Sword. As her lover poisons her to death with a dragonsbane fruit, Nyeonbi perishes with more questions than answers. When she wakes up, however, she finds herself in a different sort of peril, as she reincarnates in the body of Noble Lady Soyeo Cheon, a concubine of the imperial palace. As Soyeo, Nyeonbi must rely on her knowledge from her past life to navigate both intrigue and romance in the palace!

"
A Not So Fairy Tale,hyobin,fantasy,8.99,749971.0,354090.0,8979823.0,"When a naïve woodcutter steals the robe of a fairy descended from heaven, he condemns her to centuries trapped in the human realm. In the present day, the fairy is known as Moran Cheon, a renowned actress who is unexpectedly accused of murder. Bitter and resentful from her exile, Moran sees her plot for vengeance take shape when she discovers that Jeha Sa, a police detective tasked with investigating the murder, is the reincarnated woodcutter of centuries past. "
A Practical Guide to Evil,"David Verburg, G. Galen Mayhew, WmW, Yeajin Shin, Yui",fantasy,9.66,164041.0,81189.0,1379708.0,"The Empire stands triumphant.

For twenty years the Dread Empress has ruled over the lands that were once the Kingdom of Callow, but behind the scenes of this dawning golden age threats to the crown are rising. The nobles of the Wasteland weave their plots behind pleasant smiles while rebellion stirs beyond Peren Woods, for dreams of crowns were buried in shallow graves.

The greatest danger of all lies to the west, where the First Prince of Procer restored order at last: her people sundered, she ponders if a crusade might not be the way to secure her reign. Yet none of this matters, for in the heart of the conquered lands the most dangerous man alive sat across an orphan girl and offered her a knife.

Her name is Catherine Foundling, and she has a plan."
A Savage Proposal,"Lee yuna, team IRUKA",romance,8.12,620861.0,677158.0,11261565.0,"When the ruthless Lord Tiwakan seizes the kingdom of Nauk, Princess Liene Arsac faces an impossible choice: marry her captor or watch her homeland crumble. But Lord Tiwakan isn’t just after power; he desires Liene, and his devotion stirs a mix of fear and undeniable attraction within her. With her former betrothed, Lafitte, still missing, Liene must decide whether to trust Tiwakan's promises or hold out hope for a rescue. As dangerous secrets come to light, Liene’s decision could change the fate of Nauk—and her own heart—forever."
A Spell for a Smith,ArtSasquatch,fantasy,9.85,2420447.0,353282.0,15755166.0,"A shy witch in her quiet forest cottage. A surly dwarf in his blacksmith's forge. Both seeking solace in their respective refuge, but both aching for more. Though drawn to each other's kindness, they can't deny the gentle chemistry simmering beneath their every interaction... just as their secrets do.

This series contains themes regarding anxiety, mental health, and self-harm that may not be suitable for all readers. Viewer discretion is advised. If you or someone you know is struggling or in crisis, please reach out for help at Crisis Text Line (http://crisistextline.org/). "
A Summer Night's Dream,"Kan, Kim su bak",romance,8.07,1849855.0,551272.0,19722171.0,"Have you ever wondered if the person you like is dreaming about you? Teacher Yeoreum Han doesn't have to guess -- she can make it happen, with her ability to walk into other people's dreams. She can even link the dreams of two people together, and use this ability to play Cupid for her students. But her matchmaking goes awry when she enters the dream of Si-u Park -- a lucid dreamer, who realizes that Yeoreum is walking into his dream. Si-u and Yeoreum's lives become intertwined after this incident, weaving a tangled web of love, friendship, and dreamers at Hanseo High."
A Useless Villain,"ODI, Yeoul",action,8.68,1278937.0,458667.0,11621852.0,"High-school student Dongjin Kim seems like a typical moody teenager, but underneath it all, he's a powerful psychic ""villain"" who aims to destroy humanity. But there's a catch -- every time he uses his powers to kill, he is thrown back in time. Trapped in this time loop, Dongjin tries to narrow down the culprit by doing the one thing he knows: killing those around him. Will he be able to escape from the time loop and achieve his goal as a villain?"
A Whirlwind Campus Affair,Uiyoung,drama,9.40,2146871.0,292004.0,15772738.0,"Rumor has it that Baram Oh had an affair with her married art school professor. It’s been four years since that debacle, and now she’s back at campus to try and enjoy her college life. But she’s not the only thing who’s returned: there’s rumors of a water ghost roaming the halls, and it just might be following her around."
